{"schema":"ai-news-top/1","schemaVersion":1,"generatedAt":"2026-10-31T15:25:50Z","windowHours":24,"count":10,"site":"https://0xmortuex.github.io/ai-news-tracker/","stories":[{"id":"s-94ee8a68","title":"Apple Intelligence to roll out on iPhones in China in December with Alibaba backing","url":"https://www.scmp.com/tech/big-tech/article/3372831/apple-intelligence-roll-out-iphones-china-december-alibaba-backing","source":"SCMP Tech","sourceCount":1,"score":35,"tags":["release","policy"],"entities":["Alibaba","Apple","Apple Intelligence"],"publishedAt":"2026-10-31T10:02:17Z"},{"id":"s-9830b363","title":"Anthropic says a malicious actor used access to Cursor's marketplace to publish a \"tampered\" copy of the Claude Code extension, which it didn't build or publish (Felix Rieseberg/@felixrieseberg)","url":"https://www.techmeme.com/261031/p2#a261031p2","source":"Techmeme","sourceCount":2,"score":34,"tags":["safety","tooling"],"entities":["Anthropic","Claude Code","Cursor"],"publishedAt":"2026-10-31T05:00:15Z"},{"id":"s-559db895","title":"Introducing DeepSeek-V4.1-Flash-1017 Dynamic v3.1 Unsloth GGUFs","url":"https://www.reddit.com/r/LocalLLaMA/comments/1xjfuqh/introducing_deepseekv41flash1017_dynamic_v31/","source":"Reddit r/LocalLLaMA (top of day)","sourceCount":2,"score":27,"tags":["release"],"entities":["DeepSeek","Hugging Face","NVIDIA"],"publishedAt":"2026-10-30T13:48:01Z"},{"id":"s-ce8e2331","title":"Claude Code v2.1.316","url":"https://github.com/anthropics/claude-code/releases/tag/v2.1.316","source":"Claude Code releases","sourceCount":1,"score":26,"tags":["release","tooling"],"entities":["Anthropic","Claude Code"],"publishedAt":"2026-10-31T01:01:35Z"},{"id":"s-0d3eae43","title":"vLLM v0.33.0rc3","url":"https://github.com/vllm-project/vllm/releases/tag/v0.33.0rc3","source":"vLLM releases","sourceCount":1,"score":22,"tags":["release","tooling"],"entities":["vLLM"],"publishedAt":"2026-10-31T07:15:45Z"},{"id":"s-872dd772","title":"As AI cyber risks grow, Chinese chip expert urges shared ethics standards with US rivals","url":"https://www.scmp.com/tech/article/3372807/ai-cyber-risks-grow-chinese-chip-expert-urges-shared-ethics-standards-us-rivals","source":"SCMP Tech","sourceCount":1,"score":21,"tags":["safety"],"entities":[],"publishedAt":"2026-10-31T05:00:10Z"},{"id":"s-f00b9211","title":"dbreunig/nesformer","url":"https://simonwillison.net/2026/Oct/30/nesformer/","source":"Simon Willison","sourceCount":1,"score":20,"tags":[],"entities":["Alibaba","Qwen 3.5","Qwen3.5 4B"],"publishedAt":"2026-10-30T21:59:22Z"},{"id":"s-02508d40","title":"Just finished my humble MoE-Centric Workstation","url":"https://www.reddit.com/r/LocalLLaMA/comments/1xkau4g/just_finished_my_humble_moecentric_workstation/","source":"Reddit r/LocalLLaMA (top of day)","sourceCount":1,"score":19,"tags":["pricing"],"entities":["AMD","Qwen 4"],"publishedAt":"2026-10-31T13:54:27Z"},{"id":"s-70f740fc","title":"We Took over ChatGPT Accounts","url":"https://www.parameter.ai/labs/we-found-a-gap-at-openai","source":"Hacker News: OpenAI (50+ points)","sourceCount":1,"score":19,"tags":[],"entities":["OpenAI","ChatGPT"],"publishedAt":"2026-10-31T10:30:11Z"},{"id":"s-e70d23e7","title":"Intel’s stock crashes, knocking $12B from government’s stake","url":"https://techcrunch.com/2026/10/30/intels-stock-crashes-knocking-12b-from-governments-stake/","source":"TechCrunch AI","sourceCount":1,"score":19,"tags":["pricing"],"entities":["Intel"],"publishedAt":"2026-10-30T21:54:34Z"}]}
